doid,episode,title,startAt,endAt,BOID,strength,name,type,nature,category,url,provider,Item ID,ref price,bbox,actor,character,ref image,sampled,description,service area,service model
dwn10lbnzad4a14ba3343,1,Euphoria Season 2 Episode 1,581.0,590.0,brm50spnzdc5ec6876223,50,ADIDAS ORIGINALS ADICOLOR CLASSICS 3-STRIPES CREW SWEATSHIRT,merchandise,l,sweats,/,primary,/,/,<0.62-0.09-0.81-0.66>,Jacob Elordi,Nate Jacobs,/,585.39,/,N/A,N/A
dwn10lbnzad4a14ba3343,1,Euphoria Season 2 Episode 1,581.0,590.0,brm1spnz515b66c11338,25,River Island essential crew neck sweatshirt in black - part of a set,merchandise,l,sweats,https://www.asos.com/river-island/river-island-essential-relaxed-fit-set-in-black/grp/208416343#colourWayId-207779519&productId-207779513,asos,/,USD 65,<0.62-0.09-0.81-0.66>,Jacob Elordi,Nate Jacobs,https://images.asos-media.com/products/river-island-essential-crew-neck-sweatshirt-in-black-part-of-a-set/207779513-1-black,585.39,/,global,e-retailer
dwn10lbnzad4a14ba3343,1,Euphoria Season 2 Episode 1,581.0,590.0,brm1spnz491c0c47350,25,Aape By A Bathing Ape embossed logo sweatshirt in black,merchandise,l,sweats,https://www.asos.com/aape-by-a-bathing-ape/aape-by-a-bathing-ape-embossed-logo-sweatshirt-in-black/prd/207571352#colourWayId-207571362,asos,/,USD 145,<0.62-0.09-0.81-0.66>,Jacob Elordi,Nate Jacobs,https://images.asos-media.com/products/aape-by-a-bathing-ape-embossed-logo-sweatshirt-in-black/207571352-1-black,585.39,/,global,e-retailer
dwn10lbnzad4a14ba3343,1,Euphoria Season 2 Episode 1,581.0,590.0,brm1spnze679e2ea1421,25,AAPE By A Bathing Ape university cardigan in black,merchandise,l,sweats,https://www.asos.com/aape-by-a-bathing-ape/aape-by-a-bathing-ape-university-cardigan-in-black/prd/207241328#colourWayId-207241329,asos,/,USD 229,<0.62-0.09-0.81-0.66>,Jacob Elordi,Nate Jacobs,https://images.asos-media.com/products/aape-by-a-bathing-ape-university-cardigan-in-black/207241328-1-black,585.39,/,global,e-retailer
dwn10lbnzad4a14ba3343,1,Euphoria Season 2 Episode 1,581.0,590.0,brm1spnz174a3a551639,25,Mens Cardigan Long Open Front Draped Lightweight Hooded Sweater with Pockets,merchandise,l,sweats,https://amazon.com/dp/B07X8NZYTJ,amazon,/,USD 34.99,<0.62-0.09-0.81-0.66>,Jacob Elordi,Nate Jacobs,"https://m.media-amazon.com/images/I/31CnupXpxzL._AC_SR600,600_.jpg",585.39,/,global,platform
dwn10lbnzad4a14ba3343,1,Euphoria Season 2 Episode 1,242.0,251.0,brm50spnzbecb997c851,50,Ralph Lauren Kids' Color Block Cotton Piquet Polo Shirt In Blue,merchandise,l,shirt,/,primary,/,/,<0.18-0.19-0.94-0.84>,Angus Cloud,Fezco,/,246.7,/,N/A,N/A
dwn10lbnzad4a14ba3343,1,Euphoria Season 2 Episode 1,242.0,251.0,brm1spnz62d24ff28575,25,Neu! - Krautrock T-Shirt shirts graphic tee blue archive boys animal print korean fashion Men's t-shirt,merchandise,l,top,https://www.aliexpress.com/item/3256807991734656.html,aliexpress,/,USD 75.1,<0.18-0.19-0.94-0.84>,Angus Cloud,Fezco,https://ae-pic-a1.aliexpress-media.com/kf/S33c483ecda5d423a92219882397ff852H.jpg,246.7,/,global,platform
dwn10lbnzad4a14ba3343,1,Euphoria Season 2 Episode 1,242.0,251.0,brm1spnz36d594234520,25,Psych - A Playa Named Gus Shirt - The Smooth Storm T-Shirt shirts graphic summer clothes T-shirt men,merchandise,l,top,https://www.aliexpress.com/item/3256807940194650.html,aliexpress,/,USD 74.17,<0.18-0.19-0.94-0.84>,Angus Cloud,Fezco,https://ae-pic-a1.aliexpress-media.com/kf/S6089cc6b0baa4603aacf2f4bcd40a732H.jpg,246.7,/,global,platform
dwn10lbnzad4a14ba3343,1,Euphoria Season 2 Episode 1,242.0,251.0,brm1spnz5514d6702260,25,US Male T-Shirt oversized customs design your own big and tall t shirts for men,merchandise,l,top,https://www.aliexpress.com/item/3256807903059587.html,aliexpress,/,USD 74.89,<0.18-0.19-0.94-0.84>,Angus Cloud,Fezco,https://ae-pic-a1.aliexpress-media.com/kf/S38e2bedc30cc49f987d354812a1e7790M.jpg,246.7,/,global,platform
dwn10lbnzad4a14ba3343,1,Euphoria Season 2 Episode 1,242.0,251.0,brm1spnzebc308378142,25,Peace Sign Symbol Dark T-Shirt shirts graphic shirts graphic tee designer shirts anime men,merchandise,l,top,https://www.aliexpress.com/item/3256807903793379.html,aliexpress,/,USD 74.89,<0.18-0.19-0.94-0.84>,Angus Cloud,Fezco,https://ae-pic-a1.aliexpress-media.com/kf/S636a598cfa5d4e229459ad43319e16888.jpg,246.7,/,global,platform
dwn10lbnzad4a14ba3343,1,Euphoria Season 2 Episode 1,242.0,251.0,brm1spnz5939a5714635,25,This Is The Day We Won Away T-Shirt graphic tee shirt boys whites vintage summer tops designer t shirt men,merchandise,l,top,https://www.aliexpress.com/item/3256807901844889.html,aliexpress,/,USD 75.1,<0.18-0.19-0.94-0.84>,Angus Cloud,Fezco,https://ae-pic-a1.aliexpress-media.com/kf/Sca855758ede3437e9db481fe644f6aa3v.jpg,246.7,/,global,platform
dwn10lbnzad4a14ba3343,1,Euphoria Season 2 Episode 1,242.0,251.0,brm1spnz758a58b78859,25,Work Smart - Every Damn Day T-Shirt graphic t shirts anime quick-drying designer shirts designer t shirt men,merchandise,l,top,https://www.aliexpress.com/item/3256807901669857.html,aliexpress,/,USD 35.06,<0.18-0.19-0.94-0.84>,Angus Cloud,Fezco,https://ae-pic-a1.aliexpress-media.com/kf/See9978c818534886941352d804c07fccK.jpg,246.7,/,global,platform
dwn10lbnzad4a14ba3343,1,Euphoria Season 2 Episode 1,242.0,251.0,brm1spnz5237ace22410,25,What? T-Shirt anime boys whites new edition korean fashion heavyweight t shirts for men,merchandise,l,top,https://www.aliexpress.com/item/3256807701517052.html,aliexpress,/,USD 74.89,<0.18-0.19-0.94-0.84>,Angus Cloud,Fezco,https://ae-pic-a1.aliexpress-media.com/kf/Se3d250259fbd4ea1b2bb78d1fd5c2239L.jpg,246.7,/,global,platform
dwn10lbnzad4a14ba3343,1,Euphoria Season 2 Episode 1,242.0,251.0,brm1spnz61f1e326914,25,Comma La T-Shirt hippie clothes custom t shirt customs design your own men clothings,merchandise,l,top,https://www.aliexpress.com/item/3256807895896815.html,aliexpress,/,USD 42.4,<0.18-0.19-0.94-0.84>,Angus Cloud,Fezco,https://ae-pic-a1.aliexpress-media.com/kf/S3dd5e4672a654735a63ee58f4b56ae42K.jpg,246.7,/,global,platform
dwn10lbnzad4a14ba3343,1,Euphoria Season 2 Episode 1,242.0,251.0,brm1spnzdd417ab67500,25,Doc Holliday Tombstone For Fans T-Shirt hippie clothes cute tops designer shirts kawaii clothes men t shirts,merchandise,l,top,https://www.aliexpress.com/item/3256807888676863.html,aliexpress,/,USD 74.89,<0.18-0.19-0.94-0.84>,Angus Cloud,Fezco,https://ae-pic-a1.aliexpress-media.com/kf/Sb251d5b8eb6a40e09d6f1f23ff7b34d0M.jpg,246.7,/,global,platform
dwn10lbnzad4a14ba3343,1,Euphoria Season 2 Episode 1,256.0,3430.0,brm50spnz5c764b9b1087,50,Awge X Amina Muaddi Official “LSD Thigh-High Gladiator Crystal Heels,merchandise,l,shoes,/,primary,/,/,<0.62-0.04-0.93-0.56>*<0.39-0.42-0.67-0.55>*<0.16-0.2-0.57-0.52>*<0.44-0.45-0.53-0.96>*<0.02-0.26-0.36-0.93>*<0.19-0.18-0.89-0.45>,Alexa Demie,Maddy Perez,/,256.43-712.22-2089.65-2428.74-2846.35-3429.43,/,N/A,N/A
dwn10lbnzad4a14ba3343,1,Euphoria Season 2 Episode 1,278.0,287.0,brm50spnz08635fe71666,50,Youth Jordan Brand Black Jumpman Shooter V-Neck T-Shirt,merchandise,l,top,/,primary,/,/,<0.28-0.12-0.52-0.65>,Angus Cloud,Fezco,/,282.22,/,N/A,N/A
dwn10lbnzad4a14ba3343,1,Euphoria Season 2 Episode 1,569.0,578.0,brm50spnz8e3268ac2182,50,Supreme 7's Rugby L/s Long Sleeve Shirt Polo Green,merchandise,l,shirt,/,primary,/,/,<0.08-0.12-0.51-0.77>,Angus Cloud,Fezco,/,573.04,/,N/A,N/A
dwn10lbnzad4a14ba3343,1,Euphoria Season 2 Episode 1,1924.0,1933.0,brm50spnzccc11ca87624,50,Batsheva “Ruffle Red Pant,merchandise,l,bottoms,/,primary,/,/,<0.34-0.1-0.72-0.96>,Maude Apatow,Lexi Howard,/,1928.13,/,N/A,N/A
dwn10lbnzad4a14ba3343,1,Euphoria Season 2 Episode 1,1934.0,1943.0,brm50spnze763d3cb1145,50,Batsheva “Square Neck Cotton Top” in Turmeric Embroidered Taffeta Pattern,merchandise,l,top,/,primary,/,/,<0.1-0.05-0.56-0.97>,Maude Apatow,Lexi Howard,/,1938.91,/,N/A,N/A
dwn10lbnzad4a14ba3343,1,Euphoria Season 2 Episode 1,2086.0,2095.0,brm50spnzb8d4f1cb759,50,BP Jewelry ‘Maddy’ Necklace (Silver),merchandise,l,necklace,/,primary,/,/,<0.58-0.19-0.78-0.72>,Alexa Demie,Maddy Perez,/,2090.61,/,N/A,N/A
dwn10lbnzad4a14ba3343,1,Euphoria Season 2 Episode 1,2087.0,2096.0,brm50spnz9285628d173,50,AMIRI Playboy Bunny-print silk shirt,merchandise,l,shirt,/,primary,/,/,<0.24-0.16-0.5-0.93>,,,/,2091.87,/,N/A,N/A
dwn10lbnzad4a14ba3343,1,Euphoria Season 2 Episode 1,2227.0,2236.0,brm50spnz6c232cb02943,50,Hood By Air Layered Graphic L/S T-Shirt,merchandise,l,top,/,primary,/,/,<0.28-0.19-0.54-0.98>,,,/,2231.78,/,N/A,N/A
dwn10lbnzad4a14ba3343,1,Euphoria Season 2 Episode 1,2878.0,2887.0,brm50spnz46250eef8581,50,Prada ‘Appliquéd Patent Leather Sandals’,merchandise,l,shoes,/,primary,/,/,<0.56-0.03-0.69-0.82>,Sydney Sweeney,Cassie Howard,/,2882.13,/,N/A,N/A
dwn10lbnzad4a14ba3343,1,Euphoria Season 2 Episode 1,3038.0,3047.0,brm50spnzfaa680799549,50,House of CB Ella Dress,merchandise,l,dress,/,primary,/,/,<0.36-0.26-0.62-0.95>,Sydney Sweeney,Cassie Howard,/,3042.87,/,N/A,N/A
dwn10lbnzad4a14ba3343,1,Euphoria Season 2 Episode 1,3510.0,3519.0,brm50spnz086120714730,50,Mimi Wade Fairy Liquid Babydoll Dress,merchandise,l,dress,/,primary,/,/,<0.4-0.26-0.51-0.92>,Barbie Ferreira,Kat Hernandez,/,3514.7,/,N/A,N/A
dwn10lbnzad4a14ba3343,1,Euphoria Season 2 Episode 1,3511.0,3520.0,brm50spnzb2e535b69567,50,Pamela Love Dagger Pendant,merchandise,l,necklace,/,primary,/,/,<0.3-0.02-0.61-0.97>,Barbie Ferreira,Kat Hernandez,/,3515.26,/,N/A,N/A
dwn10lbnzad4a14ba3343,1,Euphoria Season 2 Episode 1,1934.0,1943.0,brm1spnz3ab114d36792,25,"Mean Ghouls T-Shirt, Mean Ghouls Halloween Lets Go Ghouls Spooky Season, Cute Halloween Ghost Shirt, Spooky Season Womens Tee -HF068",merchandise,l,top,https://www.etsy.com/listing/1775028163/mean-ghouls-t-shirt-mean-ghouls,etsy,/,USD 15.98,<0.1-0.05-0.56-0.97>,Maude Apatow,Lexi Howard,https://i.etsystatic.com/39256010/r/il/e1d954/6182055110/il_fullxfull.6182055110_t0ye.jpg,1938.91,/,N/A,N/A
dwn10lbnzad4a14ba3343,1,Euphoria Season 2 Episode 1,1934.0,1943.0,brm1spnze7f1176e6873,25,"Tis The Season Halloween T-shirt, Halloween Party, Spooky Pumpkin Tee, Halloween Shirt, Halloween Gift, Halloween Women Tee, Bus Shirt-HF085",merchandise,l,top,https://www.etsy.com/listing/1771908752/tis-the-season-halloween-t-shirt,etsy,/,USD 15.98,<0.1-0.05-0.56-0.97>,Maude Apatow,Lexi Howard,https://i.etsystatic.com/39256010/r/il/3189e7/6233368026/il_fullxfull.6233368026_qw9g.jpg,1938.91,/,N/A,N/A
dwn10lbnzad4a14ba3343,1,Euphoria Season 2 Episode 1,1934.0,1943.0,brm1spnzbfa251021980,25,Cute Patchwork Slim Cotton Crop Top Women Sexy Strapless Sleeveless Bow Camis Femme 2023 Summer Sweet Knitted Tank Tops Y2k Chic,merchandise,l,top,https://www.aliexpress.com/item/3256805085422198.html,aliexpress,/,USD 10.58,<0.1-0.05-0.56-0.97>,Maude Apatow,Lexi Howard,https://ae01.alicdn.com/kf/S71b1857a75164a668eecbb1b623d8904Z/Cute-Patchwork-Slim-Cotton-Crop-Top-Women-Sexy-Strapless-Sleeveless-Bow-Camis-Femme-2023-Summer-Sweet.jpg,1938.91,/,global,platform
dwn10lbnzad4a14ba3343,1,Euphoria Season 2 Episode 1,278.0,287.0,brm1spnz9426d8eb1519,25,Men's Short Sleeve Crew Neck Pima Cotton Jersey T-Shirt,merchandise,l,top,https://amazon.com/dp/B01MEHSPGK,amazon,/,USD 33.6,<0.28-0.12-0.52-0.65>,Angus Cloud,Fezco,"https://m.media-amazon.com/images/I/31PIdUJp44L._AC_SR600,600_.jpg",282.22,/,global,platform
dwn10lbnzad4a14ba3343,1,Euphoria Season 2 Episode 1,569.0,578.0,brm1spnzb4fe8dfb1589,25,Monkey Mind Men's Tank - Yoga Men Tank - Festival Wear - Sacred Geometry Mens Tee - Graphic tee - Yoga mens clothing - Space mens tank,merchandise,l,top,https://www.etsy.com/listing/1186506844/monkey-mind-mens-tank-yoga-men-tank,etsy,/,USD 26.0,<0.08-0.12-0.51-0.77>,Angus Cloud,Fezco,https://i.etsystatic.com/11338980/r/il/6fbcf2/3315856904/il_fullxfull.3315856904_ancy.jpg,573.04,/,N/A,N/A
dwn10lbnzad4a14ba3343,1,Euphoria Season 2 Episode 1,3511.0,3520.0,brm1spnzf1e000f18731,25,Adornia 14K Gold Plated Crystal Halo White Mother-Of-Pearl Clover Necklace,merchandise,l,necklace,https://www.shein.com/Adornia-14K-Gold-Plated-Crystal-Halo-White-Mother-Of-Pearl-Clover-Necklace-p-39434055.html,shein,/,USD 125,<0.3-0.02-0.61-0.97>,Barbie Ferreira,Kat Hernandez,https://img.ltwebstatic.com/images3_spmp/2024/07/24/5d/1721813504fd77b0f94dc7e62696ce6de5583bc67f_square_thumbnail_405x552.jpg,3515.26,/,global,platform
dwn10lbnzad4a14ba3343,1,Euphoria Season 2 Episode 1,3511.0,3520.0,brm1spnz7da30af7533,25,YIMERAIRE Picture Necklace 18K Gold Plated Personalized Photo Pendant for Men Customized Necklaces for Women Memory Medallion Pendant W/Tennis/Cuban/Rope Chain Dog Tag Necklace Hip Hop Jewelry,merchandise,l,necklace,https://www.amazon.com/dp/B07T3F38WH,amazon,/,USD 17.99,<0.3-0.02-0.61-0.97>,Barbie Ferreira,Kat Hernandez,https://m.media-amazon.com/images/I/41KXwcEkKdL._AC_US600_.jpg,3515.26,/,global,platform
dwn10lbnzad4a14ba3343,1,Euphoria Season 2 Episode 1,3511.0,3520.0,brm1spnzcec902669569,25,YIMERAIRE Picture Necklace 18K Gold Plated Personalized Photo Pendant for Men Customized Necklaces for Women Memory Medallion Pendant W/Tennis/Cuban/Rope Chain Dog Tag Necklace Hip Hop Jewelry,merchandise,l,necklace,https://www.amazon.com/dp/B08FD99MGT,amazon,/,USD 19.99,<0.3-0.02-0.61-0.97>,Barbie Ferreira,Kat Hernandez,https://m.media-amazon.com/images/I/71FaYWpq-PL._AC_UL960_FMwebp_QL65_.jpg,3515.26,/,global,platform
dwn10lbnzad4a14ba3343,1,Euphoria Season 2 Episode 1,3511.0,3520.0,brm1spnz97327cdf6963,25,Personalized eye necklace Mother gift Customized jewelry Human eyes Custom gift Personalized pendant Engraving Custom text Women necklace,merchandise,l,necklace,https://www.etsy.com/listing/798210254/personalized-eye-necklace-mother-gift,etsy,/,USD 22.0,<0.3-0.02-0.61-0.97>,Barbie Ferreira,Kat Hernandez,https://i.etsystatic.com/12804966/r/il/a6505b/6160827830/il_fullxfull.6160827830_6niw.jpg,3515.26,/,N/A,N/A
dwn10lbnzad4a14ba3343,1,Euphoria Season 2 Episode 1,3511.0,3520.0,brm1spnz3a1de894833,25,Sterling Silver Moon Castle Romantic AAAA zircon Necklace and sensitive earrings wire earrings/925 Silver Jewelry/women necklace,merchandise,l,necklace,https://www.etsy.com/listing/1368602626/sterling-silver-moon-castle-romantic,etsy,/,USD 42.99,<0.3-0.02-0.61-0.97>,Barbie Ferreira,Kat Hernandez,https://i.etsystatic.com/21526755/r/il/857db2/4474219198/il_fullxfull.4474219198_9hql.jpg,3515.26,/,N/A,N/A
dwn10lbnzad4a14ba3343,1,Euphoria Season 2 Episode 1,3511.0,3520.0,brm1spnz3ba65c277601,25,Mkhhy Jewelry for Women Wife Infinity Heart Birthstone I Love You Necklace for Women S925 Sterling Silver Wedding Anniversary Birthday Gifts for Wife Girlfriend Women's jewelry Diamond Pendant Necklaces Gift for Her Mom Daughter Grandma on Birthday Anniversary Christmas Mother’s Day Valentine’s Day,merchandise,l,necklace,https://www.amazon.com/dp/B09XCK5XP1,amazon,/,USD 139.99,<0.3-0.02-0.61-0.97>,Barbie Ferreira,Kat Hernandez,https://m.media-amazon.com/images/I/41U6QnWegEL._AC_US600_.jpg,3515.26,/,global,platform
dwn10lbnzad4a14ba3343,1,Euphoria Season 2 Episode 1,3511.0,3520.0,brm1spnz581603706804,25,Jovono Rhinestone Choker Necklaces Crystal Rhinestone Necklace Sparkly Long Necklace Jewelry for Women,merchandise,l,necklace,https://www.amazon.com/dp/B07JQN7MMR,amazon,/,USD 11.99,<0.3-0.02-0.61-0.97>,Barbie Ferreira,Kat Hernandez,https://m.media-amazon.com/images/I/51gETrwrzyL._AC_US600_.jpg,3515.26,/,global,platform
dwn10lbnzad4a14ba3343,1,Euphoria Season 2 Episode 1,3511.0,3520.0,brm1spnzaaa21e354146,25,S.Leaf Sterling Silver Cat Necklaces for Women Cat Jewelry for Women Cat Accessories for Women Cat Mom Lover Lady Themed Gifts Cute Silver Kitten Jewelry Birthday Gifts for Women,merchandise,l,necklace,https://www.amazon.com/dp/B01KK64SOM,amazon,/,USD 25.48,<0.3-0.02-0.61-0.97>,Barbie Ferreira,Kat Hernandez,https://m.media-amazon.com/images/I/61bH2mx0OEL._AC_UL960_FMwebp_QL65_.jpg,3515.26,/,global,platform
dwn10lbnzad4a14ba3343,1,Euphoria Season 2 Episode 1,3511.0,3520.0,brm1spnza8bd3d7d5332,25,"Urn Necklace With Dragonfly Design, Women Necklace Gift, Women Pendant, Jewelry Gift For Her, Cremation Pendant, Urn Gift For Wife",merchandise,l,necklace,https://www.etsy.com/listing/1875238534/urn-necklace-with-dragonfly-design-women,etsy,/,USD 44.98,<0.3-0.02-0.61-0.97>,Barbie Ferreira,Kat Hernandez,https://i.etsystatic.com/34950599/r/il/a1661a/6770027265/il_fullxfull.6770027265_8167.jpg,3515.26,/,N/A,N/A
dwn10lbnzad4a14ba3343,1,Euphoria Season 2 Episode 1,2086.0,2095.0,brm1spnz051d660f4206,25,XIANNVXI Necklaces for Women Crescent Moon Pendant Necklace Tree of Life Wire Wrapped Crystal Necklaces Natural Gemstone Quartz Jewelry for Women Men,merchandise,l,necklace,https://www.amazon.com/dp/B089H1G5SM,amazon,/,USD 14.99,<0.58-0.19-0.78-0.72>,Alexa Demie,Maddy Perez,https://m.media-amazon.com/images/I/41T8gu1t0zL._AC_US600_.jpg,2090.61,/,global,platform
dwn10lbnzad4a14ba3343,1,Euphoria Season 2 Episode 1,2086.0,2095.0,brm1spnzb3ca4a682493,25,Long Disc Pendant Necklace for Women 18K Gold Plated Sweater Chain Fashion Jewelry,merchandise,l,necklace,https://amazon.com/dp/B07K7BF8K5,amazon,/,USD 12.99,<0.58-0.19-0.78-0.72>,Alexa Demie,Maddy Perez,https://m.media-amazon.com/images/I/51bEeIU9uqL._AC_US600_.jpg,2090.61,/,global,platform
dwn10lbnzad4a14ba3343,1,Euphoria Season 2 Episode 1,2086.0,2095.0,brm1spnz48806d801066,25,Guardian Angel Silver Crystal Necklace - 925 Silver Crystal Symbol of Courage and Purity for Women,merchandise,l,necklace,https://amazon.com/dp/B0D8T2NFNY,amazon,/,USD 39.99,<0.58-0.19-0.78-0.72>,Alexa Demie,Maddy Perez,https://m.media-amazon.com/images/I/31Qj+J2XGRL._AC_US600_.jpg,2090.61,/,global,platform
dwn10lbnzad4a14ba3343,1,Euphoria Season 2 Episode 1,2086.0,2095.0,brm1spnz68e9f33e282,25,"Reve Reve Stainless Steel Black & Silver Cross Pendant Necklace for Men Women, 20-24 Inches Curb Chain",merchandise,l,necklace,https://www.amazon.com/dp/B073VG81KJ,amazon,/,USD 12.99,<0.58-0.19-0.78-0.72>,Alexa Demie,Maddy Perez,https://m.media-amazon.com/images/I/41aW6Zq4e2L._AC_US600_.jpg,2090.61,/,global,platform
dwn10lbnzad4a14ba3343,1,Euphoria Season 2 Episode 1,2086.0,2095.0,brm1spnz0c1c0b1b6388,25,"Vaerine 1 Set Elegant Fashion Luxury Classic 925 Sterling Silver Cubic Zirconia Shell Clover/5 Petal Flower Embellished Earrings, Necklace, Ring, Bracelet Jewelry Set, Suitable For Women Holiday, Travel, Party, Valentine's Day Gift",merchandise,l,necklace,https://www.shein.com/Vaerine-1-Set-Elegant-Fashion-Luxury-Classic-925-Sterling-Silver-Cubic-Zirconia-Shell-Clover-5-Petal-Flower-Embellished-Earrings-Necklace-Ring-Bracelet-Jewelry-Set-Suitable-For-Women-Holiday-Travel-Party-Valentine-s-Day-Gift-p-57275560.html,shein,/,USD 42.9,<0.58-0.19-0.78-0.72>,Alexa Demie,Maddy Perez,https://img.ltwebstatic.com/images3_spmp/2025/02/17/fd/1739774382d6f6e191272eae1d96d4a27ef97d230f_thumbnail_405x552.jpg,2090.61,/,global,platform
dwn10lbnzad4a14ba3343,1,Euphoria Season 2 Episode 1,2086.0,2095.0,brm1spnze599d8012352,25,"Navy blue necklace, beaded necklace, bridesmaids necklaces, dark blue seed bead necklace,navy necklace, women necklace, gifts",merchandise,l,necklace,https://www.etsy.com/listing/1259758517/navy-blue-necklace-beaded-necklace,etsy,/,USD 29.0,<0.58-0.19-0.78-0.72>,Alexa Demie,Maddy Perez,https://i.etsystatic.com/7365298/r/il/ca79b1/3976615500/il_fullxfull.3976615500_czrw.jpg,2090.61,/,N/A,N/A
dwn10lbnzad4a14ba3343,1,Euphoria Season 2 Episode 1,2086.0,2095.0,brm1spnz8f079d372238,25,1 Pc 0.5ct Simple Smile Seven Princesses Moissan Diamond Necklace S925or925 Sterling Silver Elegant Eternity Engagement Necklace Wedding Necklace Luxury Ladies Jewelry Gift,merchandise,l,necklace,https://www.shein.com/1-Pc-0-5ct-Simple-Smile-Seven-Princesses-Moissan-Diamond-Necklace-S925or925-Sterling-Silver-Elegant-Eternity-Engagement-Necklace-Wedding-Necklace-Luxury-Ladies-Jewelry-Gift-p-36518950.html,shein,/,USD 15.2,<0.58-0.19-0.78-0.72>,Alexa Demie,Maddy Perez,https://img.ltwebstatic.com/images3_spmp/2024/06/04/56/1717481809ae5723e694bb7c51a9386187392fc40c_thumbnail_405x552.jpg,2090.61,/,global,platform
dwn10lbnzad4a14ba3343,1,Euphoria Season 2 Episode 1,2086.0,2095.0,brm1spnz09a106905704,25,"Bubble Letter Initial Necklace For Women, Colorful Balloon Alphabet Name Pendant Dainty Cute 14K Gold Plated Necklaces Jewelry Gifts",merchandise,l,necklace,https://www.shein.com/Bubble-Letter-Initial-Necklace-For-Women-Colorful-Balloon-Alphabet-Name-Pendant-Dainty-Cute-14K-Gold-Plated-Necklaces-Jewelry-Gifts-p-47189603.html,shein,/,USD 16.6,<0.58-0.19-0.78-0.72>,Alexa Demie,Maddy Perez,https://img.ltwebstatic.com/images3_spmp/2024/11/07/ea/17309511760aa2bff8e2491ff8df979f5cbb05f302_square_thumbnail_405x552.jpg,2090.61,/,global,platform
dwn10lbnzad4a14ba3343,1,Euphoria Season 2 Episode 1,2086.0,2095.0,brm1spnz969a17d37424,25,"S925 Necklace Gift for Wife, Compass Jewelry Women Wedding Anniversary, Sterling Silver Girlfriend Birthday Gifts for Her, Girls Necklaces for Daughter Valentines Day Mom Mothers Day, I'd be Lost without You",merchandise,l,necklace,https://amazon.com/dp/B0BDJYS3D2,amazon,/,USD 129.99,<0.58-0.19-0.78-0.72>,Alexa Demie,Maddy Perez,https://m.media-amazon.com/images/I/41CA51mGoCL._AC_US600_.jpg,2090.61,/,global,platform
dwn10lbnzad4a14ba3343,1,Euphoria Season 2 Episode 1,569.0,578.0,brm1spnz3ffddf168761,25,Coffee Cup Beans Summer 2024 Popular Printed On Top T-Shirt Premium Cotton Luxury Designer T-Shirts For Men Top T-Shirt,merchandise,l,top,https://www.aliexpress.com/item/3256807786157547.html,aliexpress,/,USD 101.75,<0.08-0.12-0.51-0.77>,Angus Cloud,Fezco,https://ae-pic-a1.aliexpress-media.com/kf/Sb90e901e41174129ad41fcdb606a0017v.jpg,573.04,/,global,platform
dwn10lbnzad4a14ba3343,1,Euphoria Season 2 Episode 1,569.0,578.0,brm1spnz3ccbeac18016,25,Brutus © #2 T-Shirt - Dirty Buff Man Tee - Perfect Gift for Him,merchandise,l,top,https://www.etsy.com/listing/1863423888/brutus-2-t-shirt-dirty-buff-man-tee,etsy,/,USD 14.99,<0.08-0.12-0.51-0.77>,Angus Cloud,Fezco,https://i.etsystatic.com/57441189/r/il/858bcf/6841040597/il_fullxfull.6841040597_61ds.jpg,573.04,/,N/A,N/A
dwn10lbnzad4a14ba3343,1,Euphoria Season 2 Episode 1,569.0,578.0,brm1spnz663b8c9b6468,25,Official Triple Crown of Surfing Contest Hawaii Men's Limited Edition Long Sleeve Tee Shirt Original Surf Art New With Tags FREE SHIPPING,merchandise,l,top,https://www.etsy.com/listing/1534779542/official-triple-crown-of-surfing-contest,etsy,/,USD 24.5,<0.08-0.12-0.51-0.77>,Angus Cloud,Fezco,https://i.etsystatic.com/7030222/r/il/d3b87d/5255944633/il_fullxfull.5255944633_rmpo.jpg,573.04,/,N/A,N/A
dwn10lbnzad4a14ba3343,1,Euphoria Season 2 Episode 1,569.0,578.0,brm1spnzf7f60ef2407,25,"Bookish Trump T-Shirt, Felon Voting Political Shirt, Morally Gray Men Tee, Book Reader Graphic Shirt, Political Statement Tee",merchandise,l,top,https://www.etsy.com/listing/1810279504/bookish-trump-t-shirt-felon-voting,etsy,/,USD 24.99,<0.08-0.12-0.51-0.77>,Angus Cloud,Fezco,https://i.etsystatic.com/45384412/r/il/8329a0/6422663728/il_fullxfull.6422663728_7sdg.jpg,573.04,/,N/A,N/A
dwn10lbnzad4a14ba3343,1,Euphoria Season 2 Episode 1,2915.0,2924.0,brm50spnza3bab7623888,50,Online Ceramics “Sun and Moon” Sterling Silver Necklace,merchandise,l,necklace,/,primary,/,/,<0.38-0.11-0.57-0.7>,Hunter Schafer,Jules Vaughn,/,2919.87,/,N/A,N/A
dwn10lbnza7f238c61096,2,Euphoria Season 2 Episode 2,741.0,750.0,brm50spnz9ce1d6227493,50,Agent Provocateur Synthetic Berry Embellished Bikini Top,merchandise,l,sportswear,/,primary,/,/,<0.32-0.19-0.45-0.7>,Alexa Demie,Maddy Perez,/,745.61,/,N/A,N/A
dwn10lbnza7f238c61096,2,Euphoria Season 2 Episode 2,802.0,811.0,brm50spnz6388500f4928,50,"Vintage Thierry Mugler Black Space Age Cocktail Dress, 1980s",merchandise,l,dress,/,primary,/,/,<0.22-0.11-0.38-0.76>,Alexa Demie,Maddy Perez,/,806.57,/,N/A,N/A
dwn10lbnza7f238c61096,2,Euphoria Season 2 Episode 2,944.0,953.0,brm50spnz00155d7a6497,50,Blumarine Vintage Fur Collar Cardigan,merchandise,l,sweats,/,primary,/,/,<0.58-0.22-0.74-0.65>,Alexa Demie,Maddy Perez,/,948.43,/,N/A,N/A
dwn10lbnza7f238c61096,2,Euphoria Season 2 Episode 2,1113.0,1122.0,brm50spnzbb73e8322873,50,Jiwinaia Urlo Necklace,merchandise,l,necklace,/,primary,/,/,<0.49-0.2-0.69-0.89>,Barbie Ferreira,Kat Hernandez,/,1117.57,/,N/A,N/A
dwn10lbnza7f238c61096,2,Euphoria Season 2 Episode 2,1240.0,1249.0,brm50spnzf76eb16b2540,50,Fiorucci Angel Icon Hoodie (Cropped by costume dept),merchandise,l,sweats,/,primary,/,/,<0.49-0.15-0.55-0.61>,Sydney Sweeney,Cassie Howard,/,1244.39,/,N/A,N/A
dwn10lbnza7f238c61096,2,Euphoria Season 2 Episode 2,1313.0,1322.0,brm50spnz60d786fc4591,50,Lazo Schmidl John T Shirt,merchandise,l,top,/,primary,/,/,<0.3-0.14-0.52-0.91>,Hunter Schafer,Jules Vaughn,/,1317.43,/,N/A,N/A
dwn10lbnza7f238c61096,2,Euphoria Season 2 Episode 2,1313.0,1322.0,brm1spnzb3c722bb1586,25,"Girls Will Be Girls Witch Shirt, Judith Holofernes Feminism Apparel, Dark Humor Womens Tee, Feminist Gift, Smash The Patriarchy Tee For Her",merchandise,l,top,https://www.etsy.com/listing/1879839190/girls-will-be-girls-witch-shirt-judith,etsy,/,USD 18.0,<0.3-0.14-0.52-0.91>,Hunter Schafer,Jules Vaughn,https://i.etsystatic.com/53949854/r/il/ca729b/6793700707/il_fullxfull.6793700707_9wsa.jpg,1317.43,/,N/A,N/A
dwn10lbnza7f238c61096,2,Euphoria Season 2 Episode 2,944.0,953.0,brm1spnza8fa545b6139,25,Amazon Essentials Women's Lightweight Mockneck Sweater (Available in Plus Size),merchandise,l,sweats,https://amazon.com/dp/B07QC4GG78,amazon,/,USD 20.1,<0.58-0.22-0.74-0.65>,Alexa Demie,Maddy Perez,https://m.media-amazon.com/images/I/71SiAwprDhL._AC_UL320_.jpg,948.43,/,global,platform
dwn10lbnza7f238c61096,2,Euphoria Season 2 Episode 2,944.0,953.0,brm1spnzcb760277197,25,Sportswear Set Women's Spring Autumn New Korean Fashion Loose Hooded Long Sleeve Top Casual Pants Two Piece Set,merchandise,l,sweats,https://www.aliexpress.com/item/3256804611519609.html,aliexpress,/,USD 6.48,<0.58-0.22-0.74-0.65>,Alexa Demie,Maddy Perez,https://ae-pic-a1.aliexpress-media.com/kf/S3020ea0fb4454c4ba1ab666042b69406l.jpg,948.43,/,global,platform
